created_at,file_name,followers,friends,group_name,location,retweet_count,screenname,search_query,text,twitter_id,username,polarity,partition_0,partition_1
2020-07-15 20:19:37,Burnley,2231,5001,Burnley FC,Media City Salford UK,0,Gerundagula,#Burnley OR #BurnleyFC,Interesting what @BBCMOTD reports #BURWOL final score on #MOTD as looking like an off screen (??) #VAR farce wiped off #ChrisWood late penalty equaliser!??? #Burnley #Wolves https://t.co/DYdupfYUBS,1283496462014447623,Mike FC,-0.4122,EPL,Burnley
2020-07-15 19:44:23,Burnley,3431,1456,Burnley FC,"Burnley, England",1,DLRbrts,#Burnley OR #BurnleyFC,"INBOX: You have ONE new message  FROM: A friend in Stockley Park (VAR, Kevin Friend, that is!)  #BURWOL #BurnleyFC #twitterclarets https://t.co/52HjUTLhsB",1283487596635619328,Bᴜʀɴʟᴇʏsᴛᴀᴛs / Dave Roberts 📶,0.7712,EPL,Burnley
2020-07-15 19:27:42,Burnley,6687,1535,Burnley FC,"Wolverhampton, England",83,powndland,#Burnley OR #BurnleyFC,Gary Powndland - Referee Mike Dean &amp; VAR  😡⚽️😡⚽️😡  🦊🦊🦊🦊🦊🦊🦊🦊🦊🦊  SEE ME LIVE 👇🏻  18.09.20  Sutton Coldfield Town Hall  SOLD OUT  19.02.21  Stourbridge Town Hall  https://t.co/nyRnaJAn1c  #BURWOL #BurnleyFC #Wolverhampton #Wolves #Var #fuckvar https://t.co/6YPu2w1t4s,1283483396908429321,Official_Gary_Powndland,0.0,EPL,Burnley
2020-07-15 19:27:17,Burnley,133,370,Burnley FC,None of your business ,0,reecehamilton18,#Burnley OR #BurnleyFC,I highly respect this wolves side and nuno have us a really tough run around and game in both games VAR was involved for pens late on its 1-1 see you next season wolves!  Also shoutout to coady he was a brick wall for them today 👍 #wolves #burnley #BURWOL,1283483291740405761,Reece 🏴󠁧󠁢󠁥󠁮󠁧󠁿,0.4389,EPL,Burnley
2020-07-15 19:07:13,Burnley,164,719,Burnley FC,Everywhere......,1,deakinwoods,#Burnley OR #BurnleyFC,"Absolute joke of a decision by Mike Dean, surely the free kick should have been given to @wolves for the high boot about to hit @mattdoherty20 in the face!! Worse decision I’ve seen this season. #var #fansagainstvar #fa #wolves #burnley",1283478243560095746,Simon Deakin-Woods,0.7081,EPL,Burnley
2020-07-15 19:01:12,Burnley,7,11,Burnley FC,,0,ArmchairVar,#Burnley OR #BurnleyFC,🥅 | Penalty awarded. What are you saying #Wolves and #Burnley fans? #PL #VAR #BURWOL Comment your thoughts below...,1283476729953124358,Armchair VAR,-0.0772,EPL,Burnley
2020-07-15 18:59:21,Burnley,98,789,Burnley FC,Cornwall,0,TonyRodi_53,#Burnley OR #BurnleyFC,Robbed. VAR gives a penalty for handball but fails to acknowledge the high foot on #Doherty. #Wolves were robbed. #Burnley super lucky.,1283476262611116032,Tony Rodi,0.6542,EPL,Burnley
2020-07-15 18:58:21,Burnley,347,484,Burnley FC,London ,0,rockythegooner,#Burnley OR #BurnleyFC,#VAR is a farce. A #Wolves player almost gets a boot in his face from an overhead kick (dangerous play?) and #Burnley end up with a penalty. #ridiculous,1283476011523416066,Martin Rockall,-0.6908,EPL,Burnley
2020-07-15 10:13:42,CrystalPalace,4060,2717,Crystal Palace FC,England,0,CPFC_Fanly,#CrystalPalace OR #CPFC,VAR CONTROVERSY &amp; FINAL WHISTLE RED CARD | Access All Over #CPFC  https://t.co/jwcL7dRRDB https://t.co/kIrvFgbbzM,1283343977119440896,CPFC Report,0.0,EPL,CrystalPalace
2020-07-15 09:44:25,CrystalPalace,3697,1793,Crystal Palace FC,"London, England",0,ThePalaceForum,#CrystalPalace OR #CPFC,VAR CONTROVERSY &amp; FINAL WHISTLE RED CARD | Access All Over https://t.co/3RMrxMfKrI #CPFC,1283336610113884162,Crystal Palace Forum,0.0,EPL,CrystalPalace
2020-08-04 18:05:40,Everton,11977,13629,Everton FC,Everton,0,TOFnews,#Everton OR #EFC,Liverpool and Everton to discuss new rules and VAR changes at Premier League meeting - https://t.co/82Vxoj6mji #EvertonFC #EFC https://t.co/WkItIVvv6g,1290710510908911616,Toffee News,0.0,EPL,Everton
2020-07-18 18:47:11,Burnley,11598,128,Burnley FC,"Norfolk, England",0,paddyjdavitt,#Burnley OR #BurnleyFC,#burnley SD: 'I personally prefer the monitors not to be used. There is a lot of demand on the refs anyway. My view of VAR is the people in the studio must decide. But I appreciate there has been some strange calls.' #ncfc,1284560364357681152,Paddy Davitt,0.1027,EPL,Burnley
2020-07-18 17:36:33,Burnley,75,181,Burnley FC,Mumbai,0,anupamkar_08,#Burnley OR #BurnleyFC,What was the red card for? to nullify what it has done before..VAR just robbed both teams out of frustration. #epl #Norwich #BurnleyFC,1284542590398787589,Anupam Kar,-0.4767,EPL,Burnley
2020-07-18 17:28:26,Burnley,70,336,Burnley FC,,0,Nick_Lanigan,#Burnley OR #BurnleyFC,Wonder if Dyche will come out strongly about diving after this game? He's usually so vocal when players go down against Burnley. #var #Burnley,1284540544249737218,Nicholas Lanigan,0.34,EPL,Burnley
2020-07-18 17:24:11,Burnley,287,865,Burnley FC,"Chennai, India",0,koushikmutd,#Burnley OR #BurnleyFC,"Bonus points as it stands: VAR - 3 Referee - 2 Wood,Norwich city-1 😅😅😅 #FPL #Burnley #NORBUR #PremierLeague",1284539477537378304,Ed Shreeram,0.5423,EPL,Burnley
2020-07-18 17:10:55,Burnley,9323,9081,Burnley FC,,4,footballisfixed,#Burnley OR #BurnleyFC,"36 minutes - Red Card for #NorwichCity's Buendia  Kevin Friend, who confirmed the penalty as #VAR official for #BurnleyFC versus #Wolves on Wednesday, now gives a red card to Burnley's opponents on the Saturday  Who actually makes these #PGMOB appointments?",1284536137353252865,FOOTBALL is FIXED,0.0516,EPL,Burnley
2020-07-18 17:08:33,Burnley,75,181,Burnley FC,Mumbai,0,anupamkar_08,#Burnley OR #BurnleyFC,Can we stop this VAR? It’s a joke..that was not violent for god sake. #BurnleyFC #Norwich,1284535540910395393,Anupam Kar,0.0341,EPL,Burnley
2020-07-18 17:06:15,Burnley,1020,583,Burnley FC,Englands newest city circa '02,0,Worthington_PNE,#Burnley OR #BurnleyFC,VAR is a joke. Nice One. #norwich #burnley,1284534965015842820,Worthington,0.6124,EPL,Burnley
2020-07-18 16:27:16,Burnley,9323,9081,Burnley FC,,19,footballisfixed,#Burnley OR #BurnleyFC,"Since it was announced that there are investors interested in purchasing #BurnleyFC, the referees have been very supportive of club with dubious decisions &amp; #VAR  Kevin Friend has been involved as ref or #VAR official in 3 of last 4 matches; Dean &amp; Scott wear claret too  #NORBUR",1284525155088306182,FOOTBALL is FIXED,0.7089,EPL,Burnley
2020-07-18 02:51:51,Burnley,479,1092,Burnley FC,Brisbane Australia,1,therealdilonju1,#Burnley OR #BurnleyFC,IS VAR RUINING FOOTBALL?🤬 l EPL MATCHDAY 37 l PREMIER LEAGUE PREDICTIONS! https://t.co/oGJARGk9Rw  #epl #football #soccer #PremierLeague #FACup #Arsenal #Mancity #chelsea #liverpool #everton #norwich #Leicester #COYG #AFC #bournemouth #burnley #watford #therealdilonjukic https://t.co/Ztxo85Mu7W,1284319945040359426,therealdilonjukic,-0.4633,EPL,Burnley
2020-08-28 10:27:24,Liverpool,21422,117,Liverpool FC,"Liverpool, Merseyside, England",0,anfieldroad,#liverpoolfc OR #YNWA OR #LFC,Mirror: https://t.co/5sQlvNqkkU - Premier League VAR rule changes introduced for 2020/2021 season #LFC,1299292491217342464,Anfield Road,0.0,EPL,Liverpool
2020-07-16 18:18:19,Burnley,617,8,Burnley FC,UK,1,KevinFriendRef,#Burnley OR #BurnleyFC,"For those not happy with last nights VAR, Mike Dean with a beard is scary! #FactoftheDay #wolves #Burnley",1283828322435305472,Kevin Friend,-0.7572,EPL,Burnley
2020-07-16 13:21:00,Burnley,2,5,Burnley FC,,0,MistaWWFC,#Burnley OR #BurnleyFC,"#PremierLeague , #VAR farce, #MikeDean, #KevinFriend, #bbc606 , #TalkSport, #BurnleyFC , disgraceful decision to award Burnley a penalty last night. Cheats. Footballing legends will be turning in their grave at what has happened to our beautiful game. https://t.co/zMwBI7qRZN",1283753500057448448,Mister Singh,-0.4019,EPL,Burnley
2020-07-16 06:58:05,Burnley,891,352,Burnley FC,,2,URef_Official,#Burnley OR #BurnleyFC,🔥🔔BIG CONTROVERSY in #BURWOL   🔊🤏🏽A marginal majority (56%) of Fans Agreed with Mike Dean &amp; the VAR’s decision to award #BurnleyFC a late Penalty! 📲: *URef App Insight  🐺A rough call against Wolves? 👀🤷🏼‍♂️ https://t.co/YQcSUt85Gm,1283657138548555777,URef,0.4389,EPL,Burnley
2020-07-16 00:45:57,Burnley,912,490,Burnley FC,"Princeton, NJ",0,revprince,#Burnley OR #BurnleyFC,"The controversial VAR decision aside, Chris Wood took no prisoners, while banging in that last minute penalty. Some nerve! #BurnleyFC #BURWOL",1283563488305086466,Prince Varghese,-0.8622,EPL,Burnley
2020-07-15 22:37:14,Burnley,24591,2240,Burnley FC,United Kingdom,0,RetroSolesUK,#Burnley OR #BurnleyFC,"how did #Burnley get a penalty, #Doherty was clearly protecting his face from overhead kick #VAR #MOTD",1283531095884128257,Retro Soles,-0.0772,EPL,Burnley
2020-07-15 20:44:03,Burnley,3626,1501,Burnley FC,"Burnley, England",0,TheClaretsChat,#Burnley OR #BurnleyFC,JIMENEZ VOLLEY &amp; VAR PENALTY | THE GOALS | Burnley v Wolves 2019/20 https://t.co/l9QuqmzVTY #BurnleyFC,1283502613187747843,Burnley FC Fans,-0.5766,EPL,Burnley
2020-07-15 20:44:03,Burnley,3626,1501,Burnley FC,"Burnley, England",0,TheClaretsChat,#Burnley OR #BurnleyFC,LATE VAR PENALTY | COMMS CAM | Burnley v Wolves 2019/20 https://t.co/F6IxPW4tuI #BurnleyFC,1283502611686207494,Burnley FC Fans,-0.5766,EPL,Burnley
2020-07-15 20:19:37,Burnley,2231,5003,Burnley FC,Media City Salford UK,0,Gerundagula,#Burnley OR #BurnleyFC,Interesting what @BBCMOTD reports #BURWOL final score on #MOTD as looking like an off screen (??) #VAR farce wiped off #ChrisWood late penalty equaliser!??? #Burnley #Wolves https://t.co/DYdupfYUBS,1283496462014447623,Mike FC,-0.4122,EPL,Burnley
2020-07-15 19:44:23,Burnley,3452,1458,Burnley FC,"Burnley, England",1,DLRbrts,#Burnley OR #BurnleyFC,"INBOX: You have ONE new message  FROM: A friend in Stockley Park (VAR, Kevin Friend, that is!)  #BURWOL #BurnleyFC #twitterclarets https://t.co/52HjUTLhsB",1283487596635619328,Bᴜʀɴʟᴇʏsᴛᴀᴛs / Dave Roberts 📶,0.7712,EPL,Burnley
2020-08-19 16:03:09,TottenhamHotspur,1391,2459,Tottenham Hotspur FC,Ipswich,0,GavinMontana,#Tottenham OR #THFC OR #SPURS,At Spurs the VAR doesn’t say no goal it’s says no trophies #THFC,1296115493699571718,Gavin Montana,-0.5267,EPL,TottenhamHotspur
2020-08-17 08:51:24,ManchesterCity,372,998,Manchester City FC,"Port Elizabeth, South Africa",0,Siya_Juca,#ManchesterCity OR #ManCity OR #MCFC,Good morning I greet u all in the name of @BernardoCSilva who shook thousands fans of VAR FC  #ManCity,1295282065286537216,Ju Sia,0.5859,EPL,ManchesterCity
2020-08-17 05:30:00,ManchesterCity,8735,4564,Manchester City FC,Manchester,2,BlueMoonPodcast,#ManchesterCity OR #ManCity OR #MCFC,"🎙️ NEW #MCFC PODCAST:  ➡️ Pep changing system ➡️ Problems in ""both boxes"" ➡️ VAR decisions... again ➡️ Guardiola's future  🗣️ @DavidMooney | @RichardTheBurns | @SamRoscoe  🎧 Apple: https://t.co/ojshBOupdd 🎧 Spotify: https://t.co/xHk68mdS99 https://t.co/wfBQCxAJBc",1295231381296099328,Blue Moon Podcast,-0.4019,EPL,ManchesterCity
2020-08-17 04:10:37,ManchesterCity,128,92,Manchester City FC,New Delhi,0,srikantgov,#ManchesterCity OR #ManCity OR #MCFC,"United fans are strange...they still live in the past...they play in the 2nd tier in Europe, make fun of City when they lose &amp; crash out of Second tier competition the next night. No lessons from 10yrs of second class football. VAR+Penalties can’t win you cups. #ManUtd #ManCity",1295211403708493824,SGov,0.6908,EPL,ManchesterCity
2020-07-18 08:15:27,Chelsea,63,88,Chelsea FC,,0,CFCObasi_,#Chelsea OR #ChelseaFC #CFC,Frank Lampard has warned his defenders to be wary of the likes of Bruno Fernandes following a spate of controversial VAR decisions that have gone in favour of Manchester United in recent weeks. #CFC #MUNCHE #Chelsea https://t.co/o5R8r2oGK5,1284401383609896961,Obasi_,0.7096,EPL,Chelsea
2020-07-17 13:02:43,Chelsea,714,72,Chelsea FC,"London, England",1,cfcalex98,#Chelsea OR #ChelseaFC #CFC,"Solskjær complaining about a 48-hour advantage for #Chelsea in the #FACup  Semi-Final, despite the number of times VAR has helped them - examples include Palace yesterday and #CFC on the 17th February (Maguire incident and 2 goals disallowed). Karma is a ---",1284111286939398148,AlexHuyberechts🇧🇪🇺🇸,-0.0057,EPL,Chelsea
2020-07-19 08:31:07,Chelsea,451,665,Chelsea FC,,3,shyamtalks,#Chelsea OR #ChelseaFC #CFC,Mike Dean is the referee &amp; Michael Oliver will be on VAR tonight for our FA Cup semi-final against United 🤦🏻‍♂️  #FACup #MUNCHE #Chelsea #CFC #football #ChelseaFC  https://t.co/hujA3VWgE5,1284767714855104512,Shyam,0.4215,EPL,Chelsea
2020-07-22 22:43:12,ManchesterCity,313,627,Manchester City FC,,0,feed_goat,#ManchesterCity OR #ManCity OR #MCFC,Where was all this fuss when #MCFC won the league? Never mind the domestic treble?? #mediabias #mediadarlings #fuckskysports #sky #btsport #var #Liverpool #Liverpoolchampions #MCFC #ManCity,1286069313380790273,MCFC Dean 🕗,0.6416,EPL,ManchesterCity
2020-07-17 16:44:40,CrystalPalace,4058,2716,Crystal Palace FC,England,0,CPFC_Fanly,#CrystalPalace OR #CPFC,'Is the VAR broken? Serious question': Crystal Palace chairman Steve... #CrystalPalace  https://t.co/pKWnCg5kJp https://t.co/t3FuFEIl7d,1284167143391735808,CPFC Report,-0.5267,EPL,CrystalPalace
2020-07-17 16:22:29,CrystalPalace,124,284,Crystal Palace FC,,0,WojtinhoYT,#CrystalPalace OR #CPFC,Yesterday's game reminded me about something  #CPFC #MUFC  #PremierLeague #var https://t.co/X0B9jzRt1i,1284161560101957632,WojtinhoYT,0.0,EPL,CrystalPalace
2020-07-17 16:00:00,CrystalPalace,10051,4277,Crystal Palace FC,📧 info@theeaglesbeak.com,0,TheEaglesBeak,#CrystalPalace OR #CPFC,➡️👀 'VAR Hand Palace Rough Deal In Defeat To United' #CPFC   👍TEB Verdict 📺VAR 🗣️@Bacoletplayer 's point of view 📊Player ratings 🗃️Post match stats  https://t.co/6XFxpxGKBg,1284155903781019649,The Eagles Beak,0.5574,EPL,CrystalPalace
2020-07-17 14:38:18,CrystalPalace,6117,587,Crystal Palace FC,UK,1,FansAgainstVAR_,#CrystalPalace OR #CPFC,"#CPFC fans - do you want to sign the petition to scrap #VAR? It is nearing 25,000 signatures.  https://t.co/V1Njt4O0XF",1284135343478968323,Fans against VAR,0.0772,EPL,CrystalPalace
2020-07-17 13:28:19,CrystalPalace,4291,3453,Crystal Palace FC,London,0,palaceupdates4u,#CrystalPalace OR #CPFC,Manchester United have had SEVEN goals against them disallowed by VAR https://t.co/u8R2taSEef #CPFC,1284117729973338121,Crystal Palace News,0.4215,EPL,CrystalPalace
2020-07-17 12:20:37,CrystalPalace,10,0,Crystal Palace FC,,0,Jonsta1990,#CrystalPalace OR #CPFC,"Ole &amp; Phil Neville, Graham Scott &amp; VAR says it wasn't a penalty  Hodgson &amp; Jenas says it was  Go... #cpfc #mufc #CRYMUN",1284100694027522048,Jonsta,0.35700000000000004,EPL,CrystalPalace
2020-07-17 11:10:16,CrystalPalace,7591,5654,Crystal Palace FC,London,0,Gunnerian,#CrystalPalace OR #CPFC,Watching Dermot Gallagher trying to defend the decision not to award a penalty to #CPFC on @SkySportsNews demonstrates all that is wrong with #VAR in the #EPL Officials will rarely overturn a subjective decision made by their onfield MATE'S!,1284082988494598147,Ian F,-0.5806,EPL,CrystalPalace
2020-07-17 11:00:01,CrystalPalace,10051,4277,Crystal Palace FC,📧 info@theeaglesbeak.com,0,TheEaglesBeak,#CrystalPalace OR #CPFC,➡️📝 ICYMI: 'VAR Hand Palace Rough Deal In Defeat To United' #CPFC   👍TEB Verdict 📺VAR 🗣️@Bacoletplayer 's point of view 📊Player ratings 🗃️Post match stats  https://t.co/6XFxpxGKBg,1284080410549538819,The Eagles Beak,0.5574,EPL,CrystalPalace
2020-07-17 10:56:38,CrystalPalace,633,1621,Crystal Palace FC,"London, England",2,awmcs,#CrystalPalace OR #CPFC,"""A result we didn’t deserve"" – Hodgson’s makes his VAR frustration clear to the @SthLondonPress after Palace's sixth consecutive loss https://t.co/JTyqQt3grK #cpfc",1284079558963101697,Andrew McSteen,-0.4215,EPL,CrystalPalace
2020-07-17 10:40:41,CrystalPalace,229,216,Crystal Palace FC,cape Town,0,betu4ever,#CrystalPalace OR #CPFC,I will never attack or try to rob an elderly person  Now imagine United and VAR @premierleague robbing this gentleman Roy Hodgson #CrystalPalace was robbed  An elderly man was robbed on TV  #MUNCRY https://t.co/dov4Q3NyWo,1284075546335416320,Le Pèlerin,0.1911,EPL,CrystalPalace
2020-08-25 23:14:50,ManchesterCity,991,402,Manchester City FC,Riyadh 🇸🇦,25,ballviews1,#ManchesterCity OR #ManCity OR #MCFC,Who has the best attack for next season?  1. Willian - Lacazette - Aubameyang  2. Sterling - Aguero - Messi 3. Salah - Firminho - Mane  4. Pulisic - Werner - Ziyech  5. VAR - Martial - Penalties  #Messi #ManCity https://t.co/UC9WIoLFsz,1298398458848698377,ballviews,0.2732,EPL,ManchesterCity
2020-07-17 10:29:47,CrystalPalace,21,60,Crystal Palace FC,"Wigan, England",0,bigswift11,#CrystalPalace OR #CPFC,@CEO4TAG Was the VAR broken earlier in the season at Old Trafford when Martial was clearly held back in the box by Kelly and no penalty given? Serious question ? #cpfc #MUFC https://t.co/g2ijoNqmzl,1284072801725566978,bigswift1,-0.7399,EPL,CrystalPalace
2020-07-17 10:02:40,CrystalPalace,1805,2277,Crystal Palace FC,South London,1,insidecpfc,#CrystalPalace OR #CPFC,"You’d think an ex professional footballer would have some sort of morals when it comes to the #VAR debacle, but @rioferdy5 shows his true colours here.  *Note: An example of good morals is not cheating on your cancer ridden wife. #cpfc #CRYMUN   https://t.co/pgNkVs29oY",1284065977836208129,Interloper ⚽️🦅,0.6526,EPL,CrystalPalace
2020-07-17 09:52:55,CrystalPalace,215,300,Crystal Palace FC,"Manchester, England",0,DVDontheradio,#CrystalPalace OR #CPFC,"It's been another terrible week for referees &amp; match officials on planet football. #Wolves &amp; #CrystalPalace have suffered again. However, Palace chairman Steve Parish's comments about #VAR being broken are ridiculous. Surely something has to work first before it's broken? 🤨📺💰",1284063524386410496,David Haywood,-0.9022,EPL,CrystalPalace
2020-07-19 19:27:59,Southampton,32,91,Southampton FC,Southampton,0,SFCvlogZ,#SouthamptonFC OR #Southampton,*New Video*  Adams Seals Saints Win - Bournemouth Vs Southampton | Match Reaction  Click here to watch: https://t.co/2H06yS7alf  Retweets are Appriciated👊  #SaintsFC #afcbournemouth #afcb #SouthamptonFC #SFC #COYR #PL #PremierLeague #VloggleBox #BOUSOU #CheAdams #FIFA #VAR #COYS,1284933018042466304,SaintsFCvlogZ,0.5859,EPL,Southampton
2020-07-19 18:52:04,Southampton,107,138,Southampton FC,Nigeria,0,freelartltd,#SouthamptonFC OR #Southampton,'VAR happened' Bournemouth survival hopes suffer big blow  #Bournemouth #DannyIngs #goalkeeper #SamSurridge #Southampton #sports #VAR #VitalitySt https://t.co/HHvcrmPl0O https://t.co/9mbUthOpOw,1284923982257565697,Freelanews,-0.1779,EPL,Southampton
2020-07-18 15:33:09,ManchesterUnited,280,330,Manchester United FC,India,0,SiempreUtd_,#ManchesterUnited OR #ManUnited OR #MUFC,"Chelsea fans blaming VAR, Lampard crying in interviews bout it, just bcoz they lost against us 3 times. Even If they lose tomorrow they'll blame VAR no matter whatever may be the cause. Chelsea are really acting like the entire world is against them. #MUFC #CFC #EmiratesFACup",1284511533767077889,Aves Shaikh,-0.9005,EPL,ManchesterUnited
2020-09-18 13:00:00,ManchesterCity,8789,4662,Manchester City FC,Manchester,2,BlueMoonPodcast,#ManchesterCity OR #ManCity OR #MCFC,🎙️ NEW #MANCITY PODCAST  ➡️ Are #MCFC ready to go? ➡️ @RafaelH117 on Messi ➡️ @SamRoscoe on expectations ➡️ @daveazzopardi on Wolves ➡️ @DaleJohnsonESPN on VAR  🗣️ @DavidMooney | @jonnysmiffy | @CiarzScrawlings   🎧 Apple https://t.co/ojshBOcNOD 🎧 Spotify https://t.co/xHk68lWgKz https://t.co/WDRaAn8E9r,1306941041262518277,Blue Moon Podcast,0.3612,EPL,ManchesterCity
2020-09-18 05:30:00,ManchesterCity,8789,4662,Manchester City FC,Manchester,8,BlueMoonPodcast,#ManchesterCity OR #ManCity OR #MCFC,🎙️ NEW #MCFC PODCAST:  ➡️ Are #ManCity ready to go? ➡️ @RafaelH117 on Messi ➡️ @SamRoscoe on expectations ➡️ @daveazzopardi on Wolves ➡️ @DaleJohnsonESPN on VAR  🗣️ @DavidMooney | @jonnysmiffy | @CiarzScrawlings  https://t.co/Iyi6TiB533,1306827793976631297,Blue Moon Podcast,0.3612,EPL,ManchesterCity
2020-08-25 17:39:58,Arsenal,171,1231,Arsenal FC,,0,AshishAFC,#Arsenal OR #AFC OR #COYG,VAR in friendlies is must !!!! #Arsenal,1298314186410176512,Ashish Mane,0.6562,EPL,Arsenal
2020-07-20 16:09:11,ManchesterUnited,59,81,Manchester United FC,"जलगांव, भारत",0,AmitcMba,#ManchesterUnited OR #ManUnited OR #MUFC,"In the London vs Manchester battle in #FACup SF at Wembley. London won. As far as #CFC is concerned they won cause of De gea. Thats the point, all london teams including #COYS boss saying that VAR favors #MCFC &amp; #MUFC. #MUFC had a clear penalty in1st half for martial...",1285245377562599425,Amit Chaudhari,0.7506,EPL,ManchesterUnited
2020-07-18 02:51:51,AFC Bournemouth,472,1080,AFC Bournemouth,Brisbane Australia,1,therealdilonju1,#Bournemouth,IS VAR RUINING FOOTBALL?🤬 l EPL MATCHDAY 37 l PREMIER LEAGUE PREDICTIONS! https://t.co/oGJARGk9Rw  #epl #football #soccer #PremierLeague #FACup #Arsenal #Mancity #chelsea #liverpool #everton #norwich #Leicester #COYG #AFC #bournemouth #burnley #watford #therealdilonjukic https://t.co/Ztxo85Mu7W,1284319945040359426,therealdilonjukic,-0.4633,EPL,AFC Bournemouth
2020-07-18 05:53:42,LeicesterCity,1344,3151,Leicester City FC,Leicester,0,jayjay_allen,#LeicesterCity OR #LCFC,"So Harry Kane hatrick away and Premier League favourite sons Man Utd at home. We need two things. A bigger goal for Harvey Barnes, and one of us in the VAR room #lcfc",1284365709611499520,jay allėn,0.0,EPL,LeicesterCity
2020-07-17 18:06:15,LeicesterCity,396,356,Leicester City FC,India,1,LCFCIndia,#LeicesterCity OR #LCFC,"With VAR, Referees and premier league on Man Utd's side, Can we win against them? #LCFC",1284187674262175745,Leicester City India,0.5859,EPL,LeicesterCity
2020-07-17 14:26:45,LeicesterCity,553,637,Leicester City FC,,0,Sweeney_Sean,#LeicesterCity OR #LCFC,Thought this should have been a penalty @harveybarnes97   #LCFC #LeiShu #VAR 🦊  @NBCSportsSoccer https://t.co/DS7OrYg2L0,1284132437459689477,Sean Sweeney,-0.4588,EPL,LeicesterCity
2020-07-17 13:55:42,LeicesterCity,84,595,Leicester City FC,"Sheffield, England",0,daveskelton799,#LeicesterCity OR #LCFC,#manutd what the odds on #manutd getting a #var decision on last game against #LeicesterCity to get them the win they need,1284124624297623552,Dave Skelton,0.5859,EPL,LeicesterCity
2020-07-15 18:51:00,AFC Bournemouth,7,11,AFC Bournemouth,,0,ArmchairVar,#Bournemouth,"Seems like we are slow off the mark, could say we are doing as well as #VAR was the earlier #Bournemouth goal onside or offside? (Pic below) #MCIBOU #Offside #PL",1283474162477158400,Armchair VAR,0.5574,EPL,AFC Bournemouth
2020-07-15 18:40:38,AFC Bournemouth,870,4604,AFC Bournemouth,Woodbridge Suffolk,0,IRLANGMAID25,#Bournemouth,"#IRL  Evening all.  Currently watching #ManCity v #Bournemouth on @SkySportsPL, with my Dad and we are both frustrated with how #VAR is being used. #GabrielJesus gets fouled with the on-field decision being a penalty to City.  Decision is reviewed and is overturned. But my",1283471553066303489,IAIN ROBERT LANGMAID,-0.7506,EPL,AFC Bournemouth
2020-07-15 18:34:35,AFC Bournemouth,5,3,AFC Bournemouth,,0,WGD85,#Bournemouth,"#Fernandes stands on a defenders ankle, #VAR still awards a penalty to #ManchesterUnited. #Jesus does the same and the decision is correctly overturned. No consistency whatsoever #MCIBOU #ManCity #Bournemouth",1283470030064230405,LFC77,-0.2263,EPL,AFC Bournemouth
2020-07-15 18:23:30,AFC Bournemouth,7,42,AFC Bournemouth,,0,AmberBenjay,#Bournemouth,#Bournemouth are putting quite a show here.. 👏🏼👏🏼 too late though.. #Var is a disgrace 😡😡 feel sorry for them.. 🔴⚫,1283467242231853056,Benjay Amber,-0.5423,EPL,AFC Bournemouth
2020-07-15 18:20:11,AFC Bournemouth,28,103,AFC Bournemouth,"Nottingham, England",1,AngryYoungMan96,#Bournemouth,"Just imagine, Bournemouth get relegated because of Josh King's big toe. #VAR #Bournemouth #ManCity",1283466407896920064,Kieran Blogger,0.0,EPL,AFC Bournemouth
2020-07-15 17:46:31,AFC Bournemouth,594,3354,AFC Bournemouth,"Bolton, England",0,Newsham1,#Bournemouth,How can VAR NOT give Jesus a pen? 🙄😂  Get rid it's shambolic. Use the TV monitors with the refs. #Jesus  #ManCity #Bournemouth,1283457933100056576,Kyle,0.0,EPL,AFC Bournemouth
2020-07-15 17:45:27,AFC Bournemouth,8506,1109,AFC Bournemouth,United Kingdom,0,Liam_macdevitt,#Bournemouth,How is that not a pen 😂😂🤷🏽‍♂️ #ManCity #Bournemouth #var,1283457665356705797,Liam MacDevitt,0.0,EPL,AFC Bournemouth
2020-08-18 09:38:04,Liverpool,2831,1477,Liverpool FC,Nigeria,0,ziliyax,#liverpoolfc OR #YNWA OR #LFC,Your club's front 3 next season.  1. Willian.....Aubameyang ....Pepe  2. Sterling .....Jesus....Mahrez  3. Mane.....Firmino..... Salah  4. Ziyech......Werner...... Pulisic  5. VAR........Martial...... Penalties  #MUFC #AFC #CFC #LFC #MCFC,1295656199233437699,Iliyasu Zakari,0.0,EPL,Liverpool
2020-07-17 06:26:09,LeicesterCity,9326,9068,Leicester City FC,,4,footballisfixed,#LeicesterCity OR #LCFC,Glory Glory #VarUnited Glory Glory #VarUnited Glory Glory #VarUnited And the Reds matchfixing Var Var Var  #ManUnited are on course to be most favoured #PremierLeague team ever over a season - the bias is now equivalent to that behind #LeicesterCity's fake title in 15/16  #CRYMUN,1284011487674224642,FOOTBALL is FIXED,0.9665,EPL,LeicesterCity
