created_at,file_name,followers,friends,group_name,location,retweet_count,screenname,search_query,text,twitter_id,username,polarity,partition_0,partition_1
2020-09-28 05:39:25,Arsenal,514,274,Arsenal FC,,0,jonbm3,#Arsenal OR #AFC OR #COYG,"Buzzing for tonight's game, but suddenly remembered how #VAR is totally fucking up games left, right and centre. Don't know how or what to feel about it now ⚽. #AFC #Arsenal #LIVARS",1310454041277796353,JB 🤙🏾,0.0,EPL,Arsenal
2020-09-28 05:35:21,Arsenal,776,501,Arsenal FC,"Emirates Stadium, United Kingdom",0,iArsenalApp,#Arsenal OR #AFC OR #COYG,https://t.co/nEJutB4d6t: Jose Mourinho responds to VAR controversy with picture from his time at Inter https://t.co/TRUTDPGMob #afc #gooners #arsenal https://t.co/2TKLu68ama,1310453020883406848,Arsenal News 365,0.0,EPL,Arsenal
2020-09-20 07:35:14,ManchesterUnited,189,809,Manchester United FC,"Manchester, England",0,cjd78_,#ManchesterUnited OR #ManUnited OR #MUFC,"Currently putting myself through it again watching @BBCMOTD Palace so much sharper &amp; fully deserved the win. VAR penalty saga very strange. Much work to do. Players need to improve quickly, they’re levels above that performance, as they’ve demonstrated. Not acceptable #mufc",1307584084248584193,@cjd78_,0.2284,EPL,ManchesterUnited
2020-09-20 06:56:23,ManchesterUnited,1440,1137,Manchester United FC,Nigeria,1,manutdtimes,#ManchesterUnited OR #ManUnited OR #MUFC,Patrice Evra and Gary Neville agree over VAR claim during Man United loss vs Crystal Palace #MUFC #MUNCRY https://t.co/vuR8oZP497,1307574310685601792,ManUtdTimes,0.4588,EPL,ManchesterUnited
2020-09-20 06:43:56,ManchesterUnited,257,224,Manchester United FC,,0,AdamS2047,#ManchesterUnited OR #ManUnited OR #MUFC,I know we got a lot of penalties last season but man VAR shafted us yesterday😂 if that’s handball there will defo be a Penalty a game this season... #mufc,1307571176244498438,Adam,-0.6124,EPL,ManchesterUnited
2020-10-03 15:13:19,TottenhamHotspur,34,24,Tottenham Hotspur FC,,2,TheSixYardsPod,#Tottenham OR #THFC OR #SPURS,🚨Episode 3 of @TheSixYardsPod is OUT now!!🎙  We cover:  #MCFC getting battered by #LCFC   #LFC thumping #AFC   VAR ruined #THFC ‘s night   #CFC ‘s dramatic comeback to salvage a point   #MUFC ‘s late escape against Brighton   #podcast #footballpodcast #PremierLeague,1312410408871845888,The Six Yards Podcast 🎙,-0.4559,EPL,TottenhamHotspur
2020-10-03 12:39:46,TottenhamHotspur,171,528,Tottenham Hotspur FC,,0,bowlspur,#Tottenham OR #THFC OR #SPURS,Just realised we back to the horrific VAR Sunday. What a joy to watch some midweek football without the dammed evil .#THFC 🙈🤡,1312371766627651587,bowlspur,0.4434,EPL,TottenhamHotspur
2020-10-03 12:00:27,TottenhamHotspur,36,39,Tottenham Hotspur FC,United Kingdom,2,TheRoaM_,#Tottenham OR #THFC OR #SPURS,"Edition 19  Thoughts on #VAR, the @premierleague and the rules of the 'Beautiful Game' with reference to @TheAthleticUK and their recent piece and games including #NUFC #THFC, #MUFC, #BHAFC, #MCFC and #LCFC  What's your opinions? Excuse the Geordie 😅  https://t.co/EvUqdimpvi",1312361872876863489,The RoaM,0.6369,EPL,TottenhamHotspur
2020-09-22 15:55:53,CrystalPalace,17712,1764,Crystal Palace FC,"Liverpool, England",0,bbcmerseysport,#CrystalPalace OR #CPFC,FOOTBALL: Kevin Friend will be the referee for #EFC's trip to #CPFC on Saturday with Anthony Taylor on VAR. Craig Pawson will take charge of #LFC's game against #AFC on Monday with Andre Marriner on VAR duty #CRYEVE #LIVARS https://t.co/gAJSZo3c8c,1308434854518939648,BBC Merseyside Sport,0.4939,EPL,CrystalPalace
2020-09-27 23:25:04,Arsenal,2,12,Arsenal FC,,2,gwaldron0,#Arsenal OR #AFC OR #COYG,Johnny Orlando please notice me🥺 @johnnyorlando #JohnnyOrlando #johnny #JOHNNY #BBNaijialockdown2020 #orlando #NagornoKarabakh #Trump2020 #JoeBiden #Nengi #AmongUs #Quarantine #AFC #DaughtersDay2020 #netflix #tiktok #KUWTK #CFC #XRP #VAR #Memes #amongusfanart #coronavirus #bts,1310359835205079042,Grace,0.3182,EPL,Arsenal
2020-09-27 22:36:35,Arsenal,10,104,Arsenal FC,,0,GoonerCall,#Arsenal OR #AFC OR #COYG,This new handball rule is ludicrous. Was never this broken last year and why they would fix something that wasn’t broken. You just know tomorrow at Anfield David Luiz is gonna concede one of these pens 🤣 #arsenal #liverpool #epl #var #referee,1310347634511675394,Call Of Gooner,-0.9242,EPL,Arsenal
2020-09-20 06:00:00,ManchesterUnited,349059,304,Manchester United FC,"Manchester, UK",8,ManUtdMEN,#ManchesterUnited OR #ManUnited OR #MUFC,Evra would have broken the VAR monitor. That we'd like to see 😂 #mufc https://t.co/YRMBVJpkVt,1307560119681474560,Man United News,-0.1531,EPL,ManchesterUnited
2020-09-20 05:51:41,ManchesterUnited,1212,541,Manchester United FC,"Wandsworth, London",0,TonySpurano,#ManchesterUnited OR #ManUnited OR #MUFC,"Maybe, just maybe VAR have learned from the errors which aided #MUFC last season &amp; will be more fair or balanced this season. https://t.co/ENczzH9cHi",1307558025717256195,Achilles The Brave,0.0498,EPL,ManchesterUnited
2020-09-20 05:44:54,ManchesterUnited,6959,7653,Manchester United FC,"Nairobi, Kenya",0,sangura_julius,#ManchesterUnited OR #ManUnited OR #MUFC,FBI and Scotland yard to investigate who rebooted VAR settings yesterday.....  The penalty was for Bruno....  Or the settings were downloaded before Zaha signed for Crystal palace  #MUFC  #MUNCRY #EPL,1307556318539063296,#GainWithXtianDela,-0.4588,EPL,ManchesterUnited
2020-10-05 13:38:23,TottenhamHotspur,417,276,Tottenham Hotspur FC,"Johannesburg, South Africa",0,R_dney_official,#Tottenham OR #THFC OR #SPURS,"#MUFC fans, please understand that we #THFC know the feeling of VAR inaccuracy more than anyone else. My advice, don’t take it personally🤞🏽😅. #TOTMUN https://t.co/1GDv3aAIRz",1313111293843443713,#yöurboŷÜsØ🚀,0.4215,EPL,TottenhamHotspur
2020-09-27 06:04:52,ManchesterUnited,22,238,Manchester United FC,"Harare, Zimbabwe",1,ftmb90,#ManchesterUnited OR #ManUnited OR #MUFC,Yesterday VAR cane to the rescue  😂  #MUFC #BHAMUN,1310098059800522752,FTMB90,0.5106,EPL,ManchesterUnited
2020-09-27 05:52:39,ManchesterUnited,1399,668,Manchester United FC,,0,ManUtd_Focus,#ManchesterUnited OR #ManUnited OR #MUFC,"VAR Handball rule  So from what I've seen, If the ball hits your hand in the box it's a penalty even if unintentional and even if your hand is in a natural position.  If I was a manager I'd be telling my players to flick the ball up on defenders hands  Simple  #MUFC #MUFC_Family",1310094983207190528,UtdFocus,0.7351,EPL,ManchesterUnited
2020-09-27 04:37:02,ManchesterUnited,30,194,Manchester United FC,,0,SaurabhRaikar1,#ManchesterUnited OR #ManUnited OR #MUFC,Worth a read for everyone who were saying we scored after FT! #ManchesterUnited #VAR https://t.co/tZ0ivFvgkC,1310075956422275073,Saurabh Raikar,0.2942,EPL,ManchesterUnited
2020-09-27 02:32:38,ManchesterUnited,1,23,Manchester United FC,,0,bafctalks,#ManchesterUnited OR #ManUnited OR #MUFC,Brighton vs Man United 2 - 2 Full time. I thought it was over but the VAR comes into play once again. Penalty kick by Bruno Fernandes in the 10th min of extratime saves @ManUtd. Man United's defence is in shambles now. Will they rectify it?  #ManchesterUnited,1310044651005509633,Football FC,0.1531,EPL,ManchesterUnited
2020-09-27 00:40:01,ManchesterUnited,334099,602,Manchester United FC,United Kingdom,35,UnitedStandMUFC,#ManchesterUnited OR #ManUnited OR #MUFC,"Bruno: “We know, even if it’s the end of the game, he has to wait for VAR. I think it was a clear handball. We have all seen the image.” [BT] #MUFC",1310016306440220676,The United Stand,0.3818,EPL,ManchesterUnited
2020-09-27 00:04:53,ManchesterUnited,656,680,Manchester United FC,,2,Onthecounterpod,#ManchesterUnited OR #ManUnited OR #MUFC,"""VAR should [have] three decisions, very similar to the NFL-call confirmed, call stands, and call reversed""  @DrewPells on how a third outcome from VAR would have helped clarify the crazy end of Man U and Brighton  #BHAMUN #mufc #ManUtd   https://t.co/9SxpZj03y0 https://t.co/uyTBiU11pO",1310007466231463937,On The Counter Soccer Podcast,-0.34,EPL,ManchesterUnited
2020-09-26 21:52:00,TottenhamHotspur,4665,4914,Tottenham Hotspur FC,,0,solon594bce,#Tottenham OR #THFC OR #SPURS,If you can get #spurs +300 take it not advice cover your #draw #VAR https://t.co/LXuJxjCFP5,1309974027344252929,Matthew Kracht,0.0,EPL,TottenhamHotspur
2020-09-26 21:41:39,TottenhamHotspur,59,60,Tottenham Hotspur FC,the lunatic asylum ,0,CoulsdonTHFC,#Tottenham OR #THFC OR #SPURS,#BHAMUN Pogba on Connolly “penalty” was exactly the same as Dier on Pogba . One was overturned by #VAR the other upheld ??? I wonder why ? #ManUtd #PenchesterUnited #THFC,1309971422190751744,Shelf ish,0.0,EPL,TottenhamHotspur
2020-09-26 18:30:15,TottenhamHotspur,849,759,Tottenham Hotspur FC,North Florida via Belgium Park,3,ConasCycle,#Tottenham OR #THFC OR #SPURS,"#ManUtd penalty--a joke. No #Chelsea handball before they equalized--a joke. #VAR--biggest JOKE of all. Definitely an unfair advantage to the ""big"" clubs. #COYS #THFC VAR continues to ruin football.",1309923255126552578,No. Fla. Cyclist,0.2342,EPL,TottenhamHotspur
2020-09-26 17:52:32,TottenhamHotspur,3,100,Tottenham Hotspur FC,Global,0,breo_ian,#Tottenham OR #THFC OR #SPURS,#wba #chelsea #SkySports #VAR this game is so bad even the pre recorded crowd are starting to leave #thfc #PremierLeague,1309913760757428224,Ian_breo,-0.6899,EPL,TottenhamHotspur
2020-09-26 16:32:52,CrystalPalace,42,677,Crystal Palace FC,,0,CSThwaites,#CrystalPalace OR #CPFC,"To all Palace fans complaining about the penalty today...yes it may have been a bad call but please dont forget that it went in our favour last week against United. With VAR you win some and lose some, simple as that. #CPFC #CRYEVE",1309893714408546304,Christian Thwaites,0.8885,EPL,CrystalPalace
2020-09-26 16:32:45,CrystalPalace,1229,2269,Crystal Palace FC,Plymouth,0,plymoutheagle,#CrystalPalace OR #CPFC,"Deliberate handball only exists between the two 18 yard boxes cos #VAR doesn't get involved. in the box and the ball hits the hand/arm then it's going to be a penalty,#VAR can't prove deliberate or not. It is a stupid rule but we are all going to have to live with #CPFC #CRYEVE",1309893682007617537,Plymouth Eagle,0.2235,EPL,CrystalPalace
2020-09-26 16:31:11,CrystalPalace,224,882,Crystal Palace FC,,0,JSChamberlain2,#CrystalPalace OR #CPFC,"The punishment for inadvertent handball in the box is so disproportionate to the offence. Games, like the Lpool-Spurs CL final, are being won and lost by a flick of the arm that is otherwise inconsequential. Players need arms to balance #CRYEVE #var #CrystalPalace #everton #motd",1309893289462714369,J S Chamberlain,-0.128,EPL,CrystalPalace
2020-09-26 16:29:50,CrystalPalace,139,362,Crystal Palace FC,"London, England",0,Goala93730986,#CrystalPalace OR #CPFC,Roy Hodgson:  “We’ve introduced a handball rule that’s killing the game of football.”  #Handball #CRYEVE #CPFC #PremierLeague #VAR #CrystalPalace https://t.co/3fxUrxZkKR,1309892950617452544,GoalaCPFC,-0.6597,EPL,CrystalPalace
2020-09-26 16:29:11,CrystalPalace,1303,1209,Crystal Palace FC,"Uckfield, East Sussex",0,iancnoble,#CrystalPalace OR #CPFC,Roy has called it! #VAR is a nonsense! It’s killing the game! We were good for 1-1... I despair that we have introduced such a handball rule! #CPFC,1309892785412149248,Ian Noble,-0.8257,EPL,CrystalPalace
2020-09-26 16:20:48,CrystalPalace,746,1618,Crystal Palace FC,"London, England",0,awmcs,#CrystalPalace OR #CPFC,"Post-match @primevideosport @JoelWard2 interview (#CRYEVE) 1/5:  On VAR:  ""My thoughts are going to stay with myself; I think everyone else can talk about them. We’ll just kind of get on with it, we’re going to realise that some will go for us &amp; some will go against us.""  #cpfc",1309890675283025920,Andrew McSteen,0.0,EPL,CrystalPalace
2020-09-26 16:16:28,CrystalPalace,242,463,Crystal Palace FC,"London, England",0,DanielKennett77,#CrystalPalace OR #CPFC,"I thought we played really well in the 2nd half and were unlucky not to take a point from it. Players look up for the fight. Nothing you can do about VAR, we got one last week lost one this week, we move on, Townsend was superb along with Eze looked worse when he was subbed #cpfc",1309889587326660609,Dan,0.2247,EPL,CrystalPalace
2020-09-26 16:15:56,CrystalPalace,118,46,Crystal Palace FC,,0,KenPaul88,#CrystalPalace OR #CPFC,"On the wrong side of the VAR lottery today. We lost 1-2 to the Toffees (our bogey team) but hey ho, I expect many non-Palace think it balances out last week.   We go again next Saturday versus Chelsea.  Onwards and upwards 🦅 #CRYEVE  #CPFC",1309889450093281282,Ken,-0.4019,EPL,CrystalPalace
2020-09-26 16:14:44,CrystalPalace,211,77,Crystal Palace FC,Sandwich,0,gidleymike,#CrystalPalace OR #CPFC,"#cpfc I think VAR could be in the top 3 this season. 3 points today, and 2 points at Brighton earlier!",1309889149617483776,Mike Gidley,0.2714,EPL,CrystalPalace
2020-09-26 16:14:36,CrystalPalace,35,134,Crystal Palace FC,,0,Out_Vile_Jelly,#CrystalPalace OR #CPFC,"So if the ball hits your hand and you are ""leaning into the ball"" that's classed as 'deliberate'. But might you not be leaning into the ball because you're intending to head it? #cpfc  @GaryLineker  #PremierLeague #Var #CrystalPalace #MOTD",1309889115480117250,Jamie Owen,0.4939,EPL,CrystalPalace
2020-09-26 16:13:28,CrystalPalace,195,372,Crystal Palace FC,"Croydon, London",0,sxp55555,#CrystalPalace OR #CPFC,Just a bit of consistency is all I ask for #VAR #CPFC #EFC https://t.co/SsFy3HK08Q,1309888829407588354,Sean Perry,0.0,EPL,CrystalPalace
2020-09-26 16:11:25,CrystalPalace,1313,2016,Crystal Palace FC,Cambridge UK,0,dj_Sharman_cpfc,#CrystalPalace OR #CPFC,"Everton can enjoy their win and being top of the league.  With the way VAR is working out, it won’t be long until they are on the end of one of those decisions.   Not sure we are any better off with VAR in football.   #CRYEVE #cpfc #efc",1309888313181044736,Jon Sharman,0.867,EPL,CrystalPalace
2020-09-26 16:10:38,CrystalPalace,170,267,Crystal Palace FC,London,0,ThomasGothard,#CrystalPalace OR #CPFC,"I hate when palace lose, but that is a kick in the bollocks. Kevin friend is a fraud, Why didn’t DLC get a lengthy VAR check. Next time ward best leave his arms at home #cpfc",1309888117831282689,Thomas Gothard,0.34,EPL,CrystalPalace
2020-09-26 16:10:24,CrystalPalace,608,1583,Crystal Palace FC,United Kingdom,0,David_Warren9,#CrystalPalace OR #CPFC,That’s a tough loss for Palace today really starting to get frustrating with the inconsistency of referring decisions and VAR #CPFC,1309888059891220481,David,-0.6908,EPL,CrystalPalace
2020-09-26 16:05:00,CrystalPalace,83,1360,Crystal Palace FC,"Swaffham, England",0,ricgoldinho77,#CrystalPalace OR #CPFC,Horrible way to lose a game but can’t be arsed to go on a rant about VAR. We dominated second half but just didn’t create any decent chances our end product was poor. Still not too downhearted and we will be fine this season #CPFC,1309886698147504133,ricgoldinho77,-0.1894,EPL,CrystalPalace
2020-09-26 16:03:36,CrystalPalace,275,2491,Crystal Palace FC,"Haywards Heath, England",0,ChrisCPFC8,#CrystalPalace OR #CPFC,"We lost the game to a goal where nobody earnt it, and nobody did anything wrong. It was purely down to a change in the game for VAR. VAR is 100% responsible for that result.. Games dead. #cpfc",1309886347579138048,Chris Brown ≅,-0.8126,EPL,CrystalPalace
2020-09-26 16:00:54,CrystalPalace,1418064,2232,Crystal Palace FC,United Kingdom,2,talkSPORT,#CrystalPalace OR #CPFC,VAR stole the show as Everton narrowly beat Crystal Palace #CRYEVE #EFC #CPFC  https://t.co/ROXWrcOtFa,1309885670442315776,talkSPORT,0.0,EPL,CrystalPalace
2020-09-26 16:00:08,CrystalPalace,111,246,Crystal Palace FC,,0,EvilSashPioneer,#CrystalPalace OR #CPFC,"VAR helped us win at Old Trafford (but we would have won anyway), was the ONLY reason we lost today, and made Brighton still lose even after being level at FT.  All things considered, I'm still firmly in the #VARout camp.  #CPFC #CRYEVE",1309885476732575749,Adam,0.5423,EPL,CrystalPalace
2020-09-26 15:59:55,CrystalPalace,211,77,Crystal Palace FC,Sandwich,0,gidleymike,#CrystalPalace OR #CPFC,"Did all we could to get the better of the VAR decision. Great effort, against a decent side. #CPFC",1309885422324060160,Mike Gidley,0.7906,EPL,CrystalPalace
2020-09-26 15:59:32,CrystalPalace,170,267,Crystal Palace FC,London,0,ThomasGothard,#CrystalPalace OR #CPFC,If anything DCL moved his arm towards the ball? No VAR No screen check? 🤣 #cpfc https://t.co/So1pXPLN10,1309885322621267974,Thomas Gothard,-0.5803,EPL,CrystalPalace
2020-09-26 15:59:07,CrystalPalace,768,360,Crystal Palace FC,"England, United Kingdom",0,eaglesboy2,#CrystalPalace OR #CPFC,I can’t even be bothered. Modern football.  #VAR #cpfc,1309885217683972101,Rob,-0.3182,EPL,CrystalPalace
2020-09-26 15:58:03,CrystalPalace,248,291,Crystal Palace FC,"Poole, England",0,Apotts7,#CrystalPalace OR #CPFC,I’d have taken 6 points from 3 games but that VAR decision to stop a possible 7 or 9 is grim 🤮🤮 #CPFC,1309884952352354306,Aaron Potts,-0.8338,EPL,CrystalPalace
2020-09-26 15:57:33,CrystalPalace,144,309,Crystal Palace FC,"Croydon, London",0,CroydonLuke,#CrystalPalace OR #CPFC,Good performance. Unlucky with the VAR lottery #CPFC,1309884823247486976,CroydonLuke,0.4404,EPL,CrystalPalace
2020-09-26 15:57:15,CrystalPalace,168,256,Crystal Palace FC,,0,JoelGray_,#CrystalPalace OR #CPFC,"So unlucky that - VAR mugged us off big time, so much better than them in the second half #cpfc",1309884749251522560,Joel,0.4902,EPL,CrystalPalace
2020-09-26 15:56:29,CrystalPalace,113,42,Crystal Palace FC,,0,DcCpfc,#CrystalPalace OR #CPFC,#VAR is no “friend” of #cpfc #palace today. #CRYEVE https://t.co/QOw4AMA7H1,1309884554811973634,🦅 DC_CPFC 🦅,-0.29600000000000004,EPL,CrystalPalace
2020-09-26 15:54:53,CrystalPalace,704,803,Crystal Palace FC,,0,66Eagle1905,#CrystalPalace OR #CPFC,"VAR, he's your ultimate mate one week and shagging your Mrs the next. #cpfc #CRYEVE",1309884153870143488,Eagle66,0.0,EPL,CrystalPalace
2020-09-26 15:33:25,CrystalPalace,113,42,Crystal Palace FC,,0,DcCpfc,#CrystalPalace OR #CPFC,Love the LACK of consistency for 🖐 ⚽️ #CRYEVE #var #palace #cpfc,1309878753691041793,🦅 DC_CPFC 🦅,0.2885,EPL,CrystalPalace
2020-09-26 15:16:56,CrystalPalace,1293,1255,Crystal Palace FC,,0,lukefuller__,#CrystalPalace OR #CPFC,"That VAR decision seems to have knocked our confidence, understandably. #cpfc",1309874603964194822,Luke Fuller 🦅,0.5106,EPL,CrystalPalace
2020-09-26 15:06:40,CrystalPalace,1787,3319,Crystal Palace FC,,0,CoachSteveAllen,#CrystalPalace OR #CPFC,#CPFC  I said last week I knew VAR had given and would take away sometime down the road...didnt think itd he so quick as to be 1 week later 👎,1309872020138713088,Steve Allen,0.0,EPL,CrystalPalace
2020-09-26 15:06:18,CrystalPalace,111,246,Crystal Palace FC,,0,EvilSashPioneer,#CrystalPalace OR #CPFC,"Who else didn't celebrate when we scored, due to the possibility of it being cancelled out?  Fuck VAR.  #CPFC #CRYEVE",1309871928568696833,Adam,-0.8175,EPL,CrystalPalace
2020-09-26 15:05:35,CrystalPalace,355549,1426,Crystal Palace FC,,1,5liveSport,#CrystalPalace OR #CPFC,"""Just try to smash the ball at a defender's arm seems to be the new tactic""  🖐️ Matt Upson has a new tactic for attackers after VAR gave another penalty for handball  🦅 #CPFC 1-2 #EFC 🔵  📲📻 https://t.co/5Du5Yilmm1 #bbcfootball #CRYEVE https://t.co/HMpLxICLvM",1309871747991326722,BBC 5 Live Sport,-0.7717,EPL,CrystalPalace
2020-09-29 12:44:08,CrystalPalace,3697,1782,Crystal Palace FC,"London, England",0,ThePalaceForum,#CrystalPalace OR #CPFC,VAR HANDBALL GIVES EVERTON A CONTROVERSIAL PENALTY | Crystal Palace V Everton Highlights https://t.co/vsuHHQ5s4h #CPFC,1310923312558678021,Crystal Palace Forum,-0.7404,EPL,CrystalPalace
2020-09-29 11:44:13,CrystalPalace,3697,1782,Crystal Palace FC,"London, England",0,ThePalaceForum,#CrystalPalace OR #CPFC,PITCHSIDE VIEW OF VAR HANDBALL DECISIONS  | Access All Over https://t.co/BbLbDFbUpM #CPFC,1310908235159941121,Crystal Palace Forum,0.0,EPL,CrystalPalace
2020-09-27 09:26:11,Chelsea,120,117,Chelsea FC,,0,Sp0rting0pini0n,#Chelsea OR #ChelseaFC #CFC,"Make your voice heard in the Daily Football Opinion!  - Everton's start - Handball rule - Pep's ""players not machines"" claim - Will Frank last at Chelsea?  Share your thoughts &gt; https://t.co/LjYSNPhaq0  #everton #CrystalPalace #cpfc #bhafc #VAR #MCFC #CFC #Lampard #Chelsea https://t.co/CpZIoUvPci",1310148720676286465,Sporting Opinion,0.3595,EPL,Chelsea
2020-10-05 07:58:49,CrystalPalace,507,906,Crystal Palace FC,berko,0,AJWrightnBrite,#CrystalPalace OR #CPFC,It’s week 4. We have 6 points. It’s season 8 in the premier league. 2 weeks ago you were all creaming yourselves at how we played and who we signed. It’s pathetic how easily you lose any backbone. F in lightweights ‘Modern football and the VAR fantasy of perfection wankers’ #CPFC,1313025838452035584,AJWrightnBrite,0.2732,EPL,CrystalPalace
2020-09-28 21:22:13,TottenhamHotspur,17,58,Tottenham Hotspur FC,,0,MistahThizzFace,#Tottenham OR #THFC OR #SPURS,"Just saw the replay, the ball 100% touched jotas arm and they didn't even review it, how on earth is VAR so inconsistant rn?? I've never been so discouraged about watching football, starting to feel like American sports with how rigged the games are turning out. #Yikes #THFC",1310691306767749120,Mistah_ThizzFace,-0.5929,EPL,TottenhamHotspur
2020-09-28 21:04:12,TottenhamHotspur,1221,916,Tottenham Hotspur FC,,2,Alex69cent,#Tottenham OR #THFC OR #SPURS,Whenever Liverpool is playing they turned the switch of VAR off. They're just try to be ridiculously active when #MUFC and #THFC are in the pitch. #LIVARS https://t.co/YsEkmIo74C,1310686771039137792,Amir S.,0.2732,EPL,TottenhamHotspur
2020-09-28 20:30:43,TottenhamHotspur,106,683,Tottenham Hotspur FC,"Aarhus, Danmark",0,DavidWilliamsDK,#Tottenham OR #THFC OR #SPURS,"Jose post #TOTNEW +preview Chelsea.  Only Q from journalist is re. the handball, why not:  a) do your team have a problem killing games, lack of cutting edge? b) do your team have a problem defending a lead? c) Dier should stay on the ground? d) was VAR wrong with onside?  #THFC",1310678345844174862,David Williams,-0.9490000000000001,EPL,TottenhamHotspur
2020-09-28 20:00:59,TottenhamHotspur,52983,570,Tottenham Hotspur FC,,1,RickSpur,#Tottenham OR #THFC OR #SPURS,[@AlasdairGold] | The Tottenham player’s brilliant performance that shouldn’t be overshadowed by VAR handball mess.  The Danish midfielder was in top form in the middle of the pitch for Tottenham Hotspur in the draw against Newcastle United.  #THFC #COYS  https://t.co/2TIVGKTzUP,1310670863096860673,Ricky Sacks 🎙,0.7096,EPL,TottenhamHotspur
2020-09-28 20:00:01,TottenhamHotspur,3,1,Tottenham Hotspur FC,,0,LondonsFinestS2,#Tottenham OR #THFC OR #SPURS,"On today's show, the guys recap Chelsea's dramatic draw, VAR controversy for Brighton and Spurs, and Manchester City's new signing.  Miss it? Tune in here!  #THFC #Chelsea #Arsenal #MUFC #YNWA #NUFC #MCFC #LUFC #WWFC #PremierLeague #WBA #BHAFC  https://t.co/t2gWh8OlVm",1310670618669481985,London's Finest Show Feed,-0.2244,EPL,TottenhamHotspur
2020-09-28 19:53:49,TottenhamHotspur,709,488,Tottenham Hotspur FC,"Tottenham Hotspur Stadium, United Kingdom",0,iSpursApp,#Tottenham OR #THFC OR #SPURS,True Faith: Podcast: NUFC Podcast: Newcastle United handed a point at Tottenham thanks to VAR https://t.co/TQ25GdpRlL #spurs #thfc https://t.co/AkVw4TCUJ2,1310669060179464193,Tottenham News 365,0.8834,EPL,TottenhamHotspur
2020-09-28 19:49:11,TottenhamHotspur,10,21,Tottenham Hotspur FC,London,0,el_peartree,#Tottenham OR #THFC OR #SPURS,The new handball law ties in perfectly to the suits upstairs realising their dream for VAR: sponsored advert breaks in the middle of matches during excruciatingly long checks.  #THFC  #VAR  #THFCvNUFC  @jjenas8,1310667895211520001,Eli B,0.3182,EPL,TottenhamHotspur
2020-09-28 19:20:00,TottenhamHotspur,268,103,Tottenham Hotspur FC,,0,LondonsFinestQU,#Tottenham OR #THFC OR #SPURS,"VAR was centerstage again over the weekend, and (as usual), it wasn't for good reasons.  We discuss if Man Utd's penalty at the end of #BHAMUN should have been given...  #THFC #Arsenal #Chelsea #MUFC #NUFC #MCFC #YNWA #BHAFC #LUFC #VAR   https://t.co/V2MHk9Tqng",1310660548158087168,London's Finest,-0.6604,EPL,TottenhamHotspur
2020-09-28 19:03:13,TottenhamHotspur,268,103,Tottenham Hotspur FC,,0,LondonsFinestQU,#Tottenham OR #THFC OR #SPURS,"9.28: A tale of two halves for Chelsea, VAR controversy for Brighton and Spurs, Ruben Dias to Manchester City | #THFC #Chelsea #Arsenal #MUFC #YNWA #NUFC #MCFC #LUFC #WWFC #PremierLeague #WBA #BHAFC https://t.co/4T8EYyDnYq",1310656326096150528,London's Finest,0.0,EPL,TottenhamHotspur
2020-09-28 18:44:39,TottenhamHotspur,202,101,Tottenham Hotspur FC,"England, United Kingdom",0,Pearcey26,#Tottenham OR #THFC OR #SPURS,I know this is bad but I have next to no excitement about tomorrow's game. This is what the s***  VAR and crappy hand ball rules have done to me. #KilledMyLove #thfc @SpursOfficial @Carabao_Cup #RatherWatchSomethingElse,1310651651641020418,Paul Pearce,-0.09,EPL,TottenhamHotspur
2020-09-28 18:41:51,TottenhamHotspur,232,1693,Tottenham Hotspur FC,Bratislava,0,GianlucaNegro29,#Tottenham OR #THFC OR #SPURS,"The rule is bad but has been applied, what frustrates me is the lack of consistency! How is Dier’s handball but not Havertz’s? How about the one on Ndombele in the Newcastle box? #THFC #var @GrahamRoberts4 @AntonyCosta",1310650948012912640,Gianluca Negro,-0.8658,EPL,TottenhamHotspur
